{
  "protocolVersion": "project-control.dsh/v1alpha1",
  "schemaVersion": "lifecycle-command-envelope/v1alpha1",
  "commandId": "cmd_0198f4b2-7c3a-7d23-a5c6-6b6f39e34723",
  "correlationId": "corr.lifecycle.create-template",
  "idempotencyKey": "project.create-template.001",
  "kind": "project.createFromTemplate",
  "occurredAt": "2026-08-14T12:02:00.000Z",
  "actor": {
    "kind": "human",
    "id": "cyrus",
    "applicationId": "deepseek-harness-personal"
  },
  "target": {
    "aggregateType": "project",
    "projectId": "prj_0198f4b2-7c3a-7d13-a5c6-6b6f39e34713"
  },
  "expectedRevision": 0,
  "provenance": {
    "sourceType": "human",
    "sourceId": "project-console:create-confirmation",
    "applicationVersion": "0.1.0",
    "applicationInstanceId": "host-01",
    "observedAt": "2026-08-14T12:01:59.000Z"
  },
  "payload": {
    "sourceRootRef": "srt_0198f4b2-7c3a-7d43-a5c6-6b6f39e34743",
    "targetLocationRef": "loc_0198f4b2-7c3a-7d33-a5c6-6b6f39e34733",
    "directoryName": "New Managed Project",
    "name": "New Managed Project",
    "template": {
      "templateId": "software-standard",
      "templateVersion": "1.0.0",
      "templateHash": "sha256:dddddddddddddddddddddddddddddddddddddddddddddddddddddddddddddddd"
    },
    "writePlan": {
      "planId": "pln_0198f4b2-7c3a-7d61-a5c6-6b6f39e34761",
      "planHash": "sha256:f238e027d68d189d8b75d5f6a3fe3b7ac3d2b0821b7d016639e8342aea1e73dc",
      "manifestHash": "sha256:ffffffffffffffffffffffffffffffffffffffffffffffffffffffffffffffff",
      "syncPolicy": "atomic_create",
      "operations": [
        {
          "kind": "create_directory",
          "relativePath": ".dsh-project",
          "expectedState": "absent"
        },
        {
          "kind": "create_file",
          "relativePath": ".dsh-project/project.yaml",
          "expectedState": "absent",
          "contentHash": "sha256:ffffffffffffffffffffffffffffffffffffffffffffffffffffffffffffffff"
        },
        {
          "kind": "create_file",
          "relativePath": "README.md",
          "expectedState": "absent",
          "contentHash": "sha256:1111111111111111111111111111111111111111111111111111111111111111"
        }
      ]
    }
  }
}
