{
  "protocolVersion": "project-control.dsh/v1alpha1",
  "schemaVersion": "lifecycle-command-envelope/v1alpha1",
  "commandId": "cmd_0198f4b2-7c3a-7d22-a5c6-6b6f39e34722",
  "correlationId": "corr.lifecycle.register-managed",
  "idempotencyKey": "project.register-managed.001",
  "kind": "project.registerManaged",
  "occurredAt": "2026-08-14T12:01:00.000Z",
  "actor": {
    "kind": "human",
    "id": "cyrus",
    "applicationId": "deepseek-harness-personal"
  },
  "target": {
    "aggregateType": "project",
    "projectId": "prj_0198f4b2-7c3a-7d12-a5c6-6b6f39e34712"
  },
  "expectedRevision": 0,
  "provenance": {
    "sourceType": "imported_document",
    "sourceId": "manifest:.dsh-project/project.yaml",
    "applicationVersion": "0.1.0",
    "applicationInstanceId": "host-01",
    "contentHash": "sha256:cccccccccccccccccccccccccccccccccccccccccccccccccccccccccccccccc",
    "observedAt": "2026-08-14T12:00:59.000Z"
  },
  "payload": {
    "locationRef": "loc_0198f4b2-7c3a-7d32-a5c6-6b6f39e34732",
    "sourceRootRef": "srt_0198f4b2-7c3a-7d42-a5c6-6b6f39e34742",
    "candidateRef": "can_0198f4b2-7c3a-7d52-a5c6-6b6f39e34752",
    "manifestHash": "sha256:cccccccccccccccccccccccccccccccccccccccccccccccccccccccccccccccc"
  }
}
